{
  "direct_roots": [
    "accelerate",
    "huggingface-hub",
    "numpy",
    "onnx",
    "onnxruntime-gpu",
    "safetensors",
    "tokenizers",
    "torch",
    "transformers"
  ],
  "format": "pyaegean-training-resolver-manifest/1",
  "manifest_sha256": "2b2415795417aa8609fe3529555642379fd25a8f0fa42744b76cca58a058e3cc",
  "resolved_packages": [
    {
      "name": "accelerate",
      "version": "1.12.0"
    },
    {
      "name": "certifi",
      "version": "2026.6.17"
    },
    {
      "name": "charset-normalizer",
      "version": "3.4.9"
    },
    {
      "name": "filelock",
      "version": "3.29.7"
    },
    {
      "name": "flatbuffers",
      "version": "25.12.19"
    },
    {
      "name": "fsspec",
      "version": "2026.6.0"
    },
    {
      "name": "hf-xet",
      "version": "1.5.1"
    },
    {
      "name": "huggingface-hub",
      "version": "0.36.2"
    },
    {
      "name": "idna",
      "version": "3.18"
    },
    {
      "name": "jinja2",
      "version": "3.1.6"
    },
    {
      "name": "markupsafe",
      "version": "3.0.3"
    },
    {
      "name": "ml-dtypes",
      "version": "0.5.4"
    },
    {
      "name": "mpmath",
      "version": "1.3.0"
    },
    {
      "name": "networkx",
      "version": "3.6.1"
    },
    {
      "name": "numpy",
      "version": "2.3.5"
    },
    {
      "name": "nvidia-cublas-cu12",
      "version": "12.8.4.1"
    },
    {
      "name": "nvidia-cuda-cupti-cu12",
      "version": "12.8.90"
    },
    {
      "name": "nvidia-cuda-nvrtc-cu12",
      "version": "12.8.93"
    },
    {
      "name": "nvidia-cuda-runtime-cu12",
      "version": "12.8.90"
    },
    {
      "name": "nvidia-cudnn-cu12",
      "version": "9.10.2.21"
    },
    {
      "name": "nvidia-cufft-cu12",
      "version": "11.3.3.83"
    },
    {
      "name": "nvidia-cufile-cu12",
      "version": "1.13.1.3"
    },
    {
      "name": "nvidia-curand-cu12",
      "version": "10.3.9.90"
    },
    {
      "name": "nvidia-cusolver-cu12",
      "version": "11.7.3.90"
    },
    {
      "name": "nvidia-cusparse-cu12",
      "version": "12.5.8.93"
    },
    {
      "name": "nvidia-cusparselt-cu12",
      "version": "0.7.1"
    },
    {
      "name": "nvidia-nccl-cu12",
      "version": "2.27.5"
    },
    {
      "name": "nvidia-nvjitlink-cu12",
      "version": "12.8.93"
    },
    {
      "name": "nvidia-nvshmem-cu12",
      "version": "3.3.20"
    },
    {
      "name": "nvidia-nvtx-cu12",
      "version": "12.8.90"
    },
    {
      "name": "onnx",
      "version": "1.20.1"
    },
    {
      "name": "onnxruntime-gpu",
      "version": "1.25.1"
    },
    {
      "name": "packaging",
      "version": "26.2"
    },
    {
      "name": "protobuf",
      "version": "7.35.1"
    },
    {
      "name": "psutil",
      "version": "7.2.2"
    },
    {
      "name": "pyyaml",
      "version": "6.0.3"
    },
    {
      "name": "regex",
      "version": "2026.7.10"
    },
    {
      "name": "requests",
      "version": "2.34.2"
    },
    {
      "name": "safetensors",
      "version": "0.7.0"
    },
    {
      "name": "setuptools",
      "version": "83.0.0"
    },
    {
      "name": "sympy",
      "version": "1.14.0"
    },
    {
      "name": "tokenizers",
      "version": "0.22.2"
    },
    {
      "name": "torch",
      "version": "2.9.1+cu128"
    },
    {
      "name": "tqdm",
      "version": "4.68.4"
    },
    {
      "name": "transformers",
      "version": "4.57.6"
    },
    {
      "name": "triton",
      "version": "3.5.1"
    },
    {
      "name": "typing-extensions",
      "version": "4.16.0"
    },
    {
      "name": "urllib3",
      "version": "2.7.0"
    }
  ],
  "tool": {
    "name": "pip",
    "version": "26.1.2"
  }
}
